{
  "sourceContractId": "SRC-EDWCRM-CUST-BASE-v0.1",
  "version": "0.1.0",
  "system": "EDWCRM",
  "owner": "data_mapping_owner",
  "classification": "SENSITIVE",
  "effectiveFrom": "2026-08-02T00:00:00Z",
  "objects": [
    {
      "schema": "EDWCRM",
      "name": "A_ZHCX_CUST_BASE",
      "authority": "AUTHORITATIVE",
      "fields": [
        {"name": "CUSTID", "role": "primary_key", "mapsToSubject": "customer/{CUSTID}"},
        {"name": "CUSTNAME", "role": "attribute"},
        {"name": "CUSTCODE", "role": "attribute"},
        {"name": "CERTNO", "role": "attribute"},
        {"name": "CUSTTYPE", "role": "attribute"},
        {"name": "CUSTSTATUS", "role": "attribute"},
        {"name": "REGION", "role": "attribute"},
        {"name": "BRID", "role": "attribute"}
      ]
    }
  ]
}
